{
  "$schema": "./siraj_unified_constitution_rule_model.schema.json",
  "constitution": {
    "id": "SIRAJ_UNIFIED_PRODUCTION_CONSTITUTION",
    "version": "1.2.0",
    "bundle_id": "SIRAJ-CONSTITUTION-1.2.0-20260815",
    "authority": "SYSTEM_ROOT",
    "scope": "SERIES_WIDE",
    "fail_closed": true,
    "consolidation_status": "COMPLETE",
    "implementation_status": "NOT_STARTED",
    "production_authorized": false
  },
  "precedence": [
    "UNIFIED_CONSTITUTION",
    "APPROVED_SERIES_PROFILES",
    "APPROVED_EPISODE_EVIDENCE_AND_CONTRACTS",
    "APPROVED_SCRIPT_AND_NARRATION",
    "APPROVED_STORYBOARD",
    "APPROVED_PROVIDER_PAYLOADS",
    "EXECUTORS_AND_ADAPTERS",
    "RENDERS_AND_MONTAGE",
    "REPORTS_AND_CACHES"
  ],
  "states": {
    "gate_results": [
      "PASS",
      "FAIL",
      "BLOCKED"
    ],
    "submission_states": [
      "REQUEST_NOT_SENT",
      "REQUEST_SENT",
      "PROVIDER_RUNNING",
      "PROVIDER_COMPLETED",
      "PROVIDER_FAILED",
      "SUBMISSION_UNKNOWN",
      "RENDER_POLICY_FAIL",
      "RENDER_QUALITY_FAIL",
      "RENDER_PASS"
    ]
  },
  "rules": [
    {
      "id": "SIRAJ.S01.ALL_HUMAN_FACES_VISIBLE",
      "section": 1,
      "title": "حظر ظهور أي وجه بشري",
      "severity": "CRITICAL",
      "scope": "SERIES_WIDE",
      "norm": "INVARIANT",
      "value": false,
      "fail_closed": true,
      "compiler": {
        "applies": true,
        "obligations": [
          "inject_global_face_ban",
          "reject_face_positive_semantics",
          "require_safe_composition"
        ]
      },
      "validators": [
        "structured_contract_validator",
        "prompt_semantic_linter",
        "reference_face_validator",
        "all_frame_render_face_validator",
        "human_render_conformance"
      ],
      "tests": [
        "reject_visible_face_synonyms",
        "reject_partial_face",
        "reject_background_face",
        "reject_reflected_or_depicted_face",
        "accept_face_excluded_composition"
      ],
      "runtime_gates": [
        "storyboard_gate",
        "prompt_gate",
        "pre_submit_gate",
        "render_promotion_gate",
        "montage_admission_gate"
      ],
      "failure_codes": [
        "FAIL_GLOBAL_FACE_POLICY"
      ]
    },
    {
      "id": "SIRAJ.S01.PROPHET_FACE_ABSOLUTE_BAN",
      "section": 1,
      "title": "حظر وجه النبي وأجزائه بلا استثناء",
      "severity": "CRITICAL",
      "scope": "SERIES_WIDE",
      "norm": "FORBIDDEN",
      "value": {
        "full": true,
        "partial": true,
        "override_allowed": false
      },
      "fail_closed": true,
      "compiler": {
        "applies": true,
        "obligations": [
          "bind_prophet_identity",
          "forbid_any_facial_feature",
          "forbid_override"
        ]
      },
      "validators": [
        "sacred_character_contract_validator",
        "prompt_semantic_linter",
        "all_frame_render_face_validator",
        "human_render_conformance"
      ],
      "tests": [
        "reject_prophet_eye",
        "reject_prophet_mouth",
        "reject_prophet_profile",
        "reject_prophet_reflection"
      ],
      "runtime_gates": [
        "storyboard_gate",
        "prompt_gate",
        "pre_submit_gate",
        "render_promotion_gate"
      ],
      "failure_codes": [
        "FAIL_SACRED_DEPICTION",
        "FAIL_GLOBAL_FACE_POLICY"
      ]
    },
    {
      "id": "SIRAJ.S01.NON_PROPHET_FACE_DEFAULT",
      "section": 1,
      "title": "حجب وجوه غير الأنبياء بالكامل حاليًا",
      "severity": "CRITICAL",
      "scope": "SERIES_WIDE",
      "norm": "REQUIRED",
      "value": {
        "mode": "FULLY_CONCEALED",
        "partial_exception_enabled": false
      },
      "fail_closed": true,
      "compiler": {
        "applies": true,
        "obligations": [
          "forbid_partial_face_exception",
          "require_face_exclusion_or_full_occlusion"
        ]
      },
      "validators": [
        "character_contract_validator",
        "prompt_semantic_linter",
        "all_frame_render_face_validator"
      ],
      "tests": [
        "reject_non_prophet_partial_face",
        "reject_episode_override"
      ],
      "runtime_gates": [
        "prompt_gate",
        "render_promotion_gate",
        "montage_admission_gate"
      ],
      "failure_codes": [
        "FAIL_GLOBAL_FACE_POLICY"
      ]
    },
    {
      "id": "SIRAJ.S01.UNSEEN_NON_INVENTION",
      "section": 1,
      "title": "عدم تجسيد الذات الإلهية أو اختراع هيئة الغيب",
      "severity": "CRITICAL",
      "scope": "SERIES_WIDE",
      "norm": "FORBIDDEN",
      "value": "UNSUPPORTED_UNSEEN_FORM_OR_MECHANISM",
      "fail_closed": true,
      "compiler": {
        "applies": true,
        "obligations": [
          "prefer_observable_consequence",
          "reject_unsupported_unseen_form"
        ]
      },
      "validators": [
        "source_claim_validator",
        "unseen_representation_validator",
        "prompt_semantic_linter",
        "human_theological_review"
      ],
      "tests": [
        "reject_divine_depiction",
        "reject_unsupported_angel_form",
        "reject_magic_visual_shortcut"
      ],
      "runtime_gates": [
        "research_gate",
        "storyboard_gate",
        "prompt_gate",
        "render_promotion_gate"
      ],
      "failure_codes": [
        "FAIL_SACRED_DEPICTION",
        "FAIL_UNSEEN_INVENTION"
      ]
    },
    {
      "id": "SIRAJ.S01.MODESTY",
      "section": 1,
      "title": "الستر والوقار",
      "severity": "CRITICAL",
      "scope": "SERIES_WIDE",
      "norm": "REQUIRED",
      "value": {
        "female": "MAXIMUM_APPROVED_MODESTY",
        "male": "MODEST_PERIOD_APPROPRIATE"
      },
      "fail_closed": true,
      "compiler": {
        "applies": true,
        "obligations": [
          "bind_wardrobe_contract",
          "inject_modesty_constraints"
        ]
      },
      "validators": [
        "wardrobe_contract_validator",
        "prompt_semantic_linter",
        "all_frame_modesty_validator",
        "human_render_conformance"
      ],
      "tests": [
        "reject_exposed_female_skin",
        "reject_body_defining_clothing",
        "reject_unnecessary_male_exposure",
        "reject_required_character_omission"
      ],
      "runtime_gates": [
        "character_gate",
        "prompt_gate",
        "render_promotion_gate",
        "montage_admission_gate"
      ],
      "failure_codes": [
        "FAIL_FEMALE_MODESTY",
        "FAIL_WARDROBE_POLICY",
        "FAIL_CHARACTER_REQUIRED_BUT_OMITTED"
      ]
    },
    {
      "id": "SIRAJ.S01.PERIOD_AUTHENTICITY",
      "section": 1,
      "title": "أصالة الحقبة مع رفض المفارقة المادية الواضحة وإبقاء المجهول محايدًا",
      "severity": "HIGH",
      "scope": "SERIES_WIDE",
      "norm": "REQUIRED",
      "value": {
        "material_demonstrable_anachronism": "HARD_FAIL",
        "unknown_policy": "NEUTRAL_DO_NOT_INVENT",
        "minor_uncertain_detail": "WEIGHTED_REVIEW",
        "certainty_must_follow_evidence": true
      },
      "fail_closed": true,
      "compiler": {
        "applies": true,
        "obligations": [
          "bind_period_dossier",
          "forbid_material_demonstrable_anachronisms",
          "preserve_unknowns",
          "avoid_false_precision_for_uncertain_minor_details"
        ]
      },
      "validators": [
        "period_evidence_validator",
        "storyboard_period_validator",
        "prompt_period_validator",
        "render_period_validator"
      ],
      "tests": [
        "reject_material_demonstrable_anachronism",
        "reject_unsupported_period_claim",
        "accept_neutral_art_direction_for_unknown",
        "route_minor_uncertain_detail_to_weighted_review"
      ],
      "runtime_gates": [
        "research_gate",
        "storyboard_gate",
        "prompt_gate",
        "render_promotion_gate"
      ],
      "failure_codes": [
        "FAIL_PERIOD_ANACHRONISM",
        "FAIL_UNSUPPORTED_MATERIAL_CULTURE",
        "FAIL_PERIOD_IMMERSION"
      ]
    },
    {
      "id": "SIRAJ.S01.RECURRING_CHARACTER_CANONICAL_STILL",
      "section": 1,
      "title": "مرجع ثابت قانوني لكل شخصية متكررة",
      "severity": "HIGH",
      "scope": "SERIES_WIDE",
      "norm": "REQUIRED",
      "value": true,
      "fail_closed": true,
      "compiler": {
        "applies": true,
        "obligations": [
          "bind_character_id",
          "bind_reference_hash",
          "bind_wardrobe_and_silhouette_versions"
        ]
      },
      "validators": [
        "canonical_still_validator",
        "reference_provenance_validator",
        "continuity_validator"
      ],
      "tests": [
        "reject_missing_recurring_character_still",
        "reject_failed_render_as_reference",
        "reject_reference_hash_drift"
      ],
      "runtime_gates": [
        "character_gate",
        "prompt_gate",
        "pilot_gate",
        "render_promotion_gate"
      ],
      "failure_codes": [
        "FAIL_CHARACTER_APPEARANCE",
        "FAIL_CHARACTER_MUTATION",
        "FAIL_CONTINUITY"
      ]
    },
    {
      "id": "SIRAJ.S02.SOURCE_HIERARCHY",
      "section": 2,
      "title": "هرمية المصادر وعدم تجاوز الأدنى للأعلى",
      "severity": "CRITICAL",
      "scope": "SERIES_WIDE",
      "norm": "INVARIANT",
      "value": "LOWER_SOURCE_MAY_NOT_OVERRIDE_HIGHER_SOURCE",
      "fail_closed": true,
      "compiler": {
        "applies": true,
        "obligations": [
          "bind_claim_to_source",
          "carry_certainty_to_script_and_visuals"
        ]
      },
      "validators": [
        "claim_ledger_validator",
        "source_hierarchy_validator",
        "script_claim_validator",
        "visual_claim_validator"
      ],
      "tests": [
        "reject_unsourced_core_claim",
        "reject_lower_source_override",
        "reject_certainty_upgrade"
      ],
      "runtime_gates": [
        "research_gate",
        "script_gate",
        "storyboard_gate",